{
  "$schema": "https://json-schema.org/draft/2020-12/schema",
  "$id": "body_sequence.json",
  "title": "BodySequence",
  "description": "A rendering sequence driven by pose assets instead of motion CSVs. hand_motions entries are pose motion description JSONs, not CSVs.",
  "type": "object",
  "required": [
    "name",
    "body_rig",
    "hand_motions",
    "frames"
  ],
  "additionalProperties": false,
  "properties": {
    "name": {
      "type": "string"
    },
    "body_rig": {
      "$ref": "body_rig.json"
    },
    "hand_motions": {
      "type": "array",
      "minItems": 1,
      "items": {
        "type": "string"
      },
      "description": "Paths to pose motion description JSONs (see pose_motion.json)."
    },
    "frames": {
      "type": "integer",
      "minimum": 1,
      "description": "How many frames to render per motion, spread evenly across the whole timeline. 2 gives the first and last frame. Overridden by --frames on the command line."
    },
    "hdri": {
      "type": "string",
      "description": "Path to an HDR/EXR environment map for world lighting. When omitted the model's own lights are used."
    },
    "accessories": {
      "type": "array",
      "items": {
        "enum": [
          "ring1",
          "ring2",
          "watch1",
          "band1"
        ]
      },
      "uniqueItems": true,
      "description": "Accessories the body wears for this whole clip. Absent or empty means bare hands; nothing is ever inherited from how the .blend was saved."
    }
  }
}
