{
  "name": "model2",
  "body_rig": {
    "cameras": [
      {
        "name": "head0",
        "intrinsics": {
          "name": "pinhole",
          "parameters": {
            "fx": 240.0,
            "fy": 240.0,
            "cx": 320.0,
            "cy": 240.0
          }
        },
        "resolution": [
          640,
          480
        ],
        "pixel_format": "MONO8",
        "shutter": "global",
        "ca_factor": 0.3,
        "distortion": 0.387,
        "dispersion": 0.0,
        "lens_scale": 1.2,
        "vignette_factor": 0.533,
        "vignette_feather": 0.4,
        "noise_std": 0.2,
        "chroma_noise": 0.0
      }
    ],
    "body": {
      "name": "model2",
      "model": "../../models/model2/model2.blend",
      "armature": "rig",
      "hands": [
        "right",
        "left"
      ]
    },
    "head_camera": {
      "anchor_bone": "ORG-spine.006",
      "rest_position": [
        0.0,
        -0.19,
        1.564
      ],
      "rest_forward": [
        0.0,
        -1.0,
        -0.268
      ]
    }
  },
  "hand_motions": [
    "animation01.json"
  ],
  "frames": 31,
  "hdri": "../../hdri/brown_photostudio_02_2k.exr"
}
